<Diagram name="GeneTF" version="2.00" xmlns:xsi="http://www.w3.org/2001/XMLSchema-instance" xsi:noNamespaceSchemaLocation="Uml.xsd">
	<Namespace name="genetf">
		<Association _id="idd" name="Regulation" assocClass="id3" nonpersistent="false">
			<AssociationRole _id="ide" max="-1" min="0" name="gene" target="ida" isPrimary="false" isNavigable="true"/>
			<AssociationRole _id="idf" max="-1" min="0" name="tf" target="id7" isPrimary="false" isNavigable="true"/>
		</Association>
		<Class _id="id3" name="Regulation" childRoles="id4" isAbstract="false" association="idd">
			<Attribute max="1" min="1" name="type" type="Integer" ordered="false" defvalue="0;" registry="false" visibility="public" nonpersistent="false"/>
		</Class>
		<Class _id="id7" name="TF" childRoles="id8" isAbstract="false" associationRoles="idf">
			<Attribute max="1" min="1" name="name" type="String" ordered="false" registry="false" visibility="public" nonpersistent="false"/>
		</Class>
		<Class _id="ida" name="Gene" childRoles="idb" isAbstract="false" associationRoles="ide">
			<Attribute max="1" min="1" name="name" type="String" ordered="false" registry="false" visibility="public" nonpersistent="false"/>
		</Class>
		<Class _id="id5" name="Container" isAbstract="false" parentRoles="id6 id9 idc"/>
		<Composition name="Composition" nonpersistent="false">
			<CompositionChildRole _id="id4" max="-1" min="0" target="id3" isNavigable="true"/>
			<CompositionParentRole _id="id6" target="id5" isNavigable="true"/>
		</Composition>
		<Composition name="Composition" nonpersistent="false">
			<CompositionChildRole _id="id8" max="-1" min="0" target="id7" isNavigable="true"/>
			<CompositionParentRole _id="id9" target="id5" isNavigable="true"/>
		</Composition>
		<Composition name="Composition" nonpersistent="false">
			<CompositionChildRole _id="idb" max="-1" min="0" target="ida" isNavigable="true"/>
			<CompositionParentRole _id="idc" target="id5" isNavigable="true"/>
		</Composition>
	</Namespace>
</Diagram>


