<Diagram name="GeneTRE" version="2.00" xmlns:xsi="http://www.w3.org/2001/XMLSchema-instance" xsi:noNamespaceSchemaLocation="Uml.xsd">
	<Namespace name="genetre">
		<Association name="Association" nonpersistent="false">
			<AssociationRole _id="id10" max="-1" min="0" name="tf" target="id7" isPrimary="false" isNavigable="true"/>
			<AssociationRole _id="id11" max="-1" min="0" name="bindsTo" target="ida" isPrimary="false" isNavigable="true"/>
		</Association>
		<Association _id="id12" name="TRE" assocClass="id3" nonpersistent="false">
			<AssociationRole _id="id13" max="-1" min="0" name="gene" target="idd" isPrimary="false" isNavigable="true"/>
			<AssociationRole _id="id14" max="-1" min="0" name="site" target="ida" isPrimary="false" isNavigable="true"/>
		</Association>
		<Class _id="id3" name="TRE" childRoles="id4" isAbstract="false" association="id12">
			<Attribute max="1" min="1" name="regulation" type="Integer" ordered="false" defvalue="0;" registry="false" visibility="public" nonpersistent="false"/>
			<Attribute max="1" min="1" name="position" type="Integer" ordered="false" registry="false" visibility="public" nonpersistent="false"/>
			<Attribute max="1" min="1" name="strand" type="Boolean" ordered="false" registry="false" visibility="public" nonpersistent="false"/>
			<Attribute max="1" min="1" name="coreScore" type="Real" ordered="false" registry="false" visibility="public" nonpersistent="false"/>
			<Attribute max="1" min="1" name="matrixScore" type="Real" ordered="false" registry="false" visibility="public" nonpersistent="false"/>
		</Class>
		<Class _id="id7" name="TF" childRoles="id8" isAbstract="false" associationRoles="id10">
			<Attribute max="1" min="1" name="name" type="String" ordered="false" registry="false" visibility="public" nonpersistent="false"/>
		</Class>
		<Class _id="ida" name="PWM" childRoles="idb" isAbstract="false" associationRoles="id11 id14">
			<Attribute max="1" min="1" name="name" type="String" ordered="false" registry="false" visibility="public" nonpersistent="false"/>
		</Class>
		<Class _id="idd" name="Gene" childRoles="ide" isAbstract="false" associationRoles="id13">
			<Attribute max="1" min="1" name="name" type="String" ordered="false" registry="false" visibility="public" nonpersistent="false"/>
		</Class>
		<Class _id="id5" name="Container" isAbstract="false" parentRoles="id6 id9 idc idf"/>
		<Composition name="Composition" nonpersistent="false">
			<CompositionChildRole _id="id4" max="-1" min="0" target="id3" isNavigable="true"/>
			<CompositionParentRole _id="id6" target="id5" isNavigable="true"/>
		</Composition>
		<Composition name="Composition" nonpersistent="false">
			<CompositionChildRole _id="id8" max="-1" min="0" target="id7" isNavigable="true"/>
			<CompositionParentRole _id="id9" target="id5" isNavigable="true"/>
		</Composition>
		<Composition name="Composition" nonpersistent="false">
			<CompositionChildRole _id="idb" max="-1" min="0" target="ida" isNavigable="true"/>
			<CompositionParentRole _id="idc" target="id5" isNavigable="true"/>
		</Composition>
		<Composition name="Composition" nonpersistent="false">
			<CompositionChildRole _id="ide" max="-1" min="0" target="idd" isNavigable="true"/>
			<CompositionParentRole _id="idf" target="id5" isNavigable="true"/>
		</Composition>
	</Namespace>
</Diagram>


