<?xml version="1.0"?>

<Diagram name ="UdmProject"
   version="1.00"
   xmlns:xsi="http://www.w3.org/2001/XMLSchema-instance"
   xsi:noNamespaceSchemaLocation="Uml.xsd">

   <!-- Generated by the UML2XML interpreter -->

<Class _id="id00007" name= "Datanetwork" isAbstract= "false" childRoles= " id00002 id00004 id00006" >
   <Attribute name= "systemname" type= "String" ordered= "false" visibility= "public" nonpersistent= "false" registry= "false" min= "1" max= "1"/>
   <Attribute name= "metaDgr" type= "String" ordered= "false" visibility= "public" nonpersistent= "false" registry= "false" min= "1" max= "1"/>
   <Attribute name= "metalocator" type= "String" ordered= "false" visibility= "public" nonpersistent= "false" registry= "false" min= "0" max= "1"/>
</Class>
<Class _id="id00008" name= "Project" isAbstract= "false" parentRoles= " id00001 id00003 id00005" >
   <Attribute name= "name" type= "String" ordered= "false" visibility= "public" nonpersistent= "false" registry= "false" min= "1" max= "1"/>
</Class>
<Composition>
   <CompositionChildRole _id= "id00002" name= "crosslinks" min= "0" max= "1" target= "id00007"/>
   <CompositionParentRole _id= "id00001" target= "id00008"/>
</Composition>
<Composition>
   <CompositionChildRole _id= "id00004" name= "instances" min= "0" max= "-1" target= "id00007"/>
   <CompositionParentRole _id= "id00003" target= "id00008"/>
</Composition>
<Composition>
   <CompositionChildRole _id= "id00006" name= "cross_associations" min= "0" max= "1" target= "id00007"/>
   <CompositionParentRole _id= "id00005" target= "id00008"/>
</Composition>
</Diagram>
